Code	Short	Long
RNWWNDONS	Resource process for wind energy, onshore	Resource process for wind energy, onshore
RSERVPGAS00	Existing service pipelines for natural gas in the residential sector	Existing service pipelines for natural gas in the residential sector
RSERVPGAS01	New service pipelines for natural gas in the residential sector	New service pipelines for natural gas in the residential sector
RSERVPHYG01	New service pipelines for hydrogen in the residential sector	New service pipelines for hydrogen in the residential sector
RWATESTAND-E	Hot water from stand-alone systems for existing houses	Hot water from stand-alone systems for existing houses
RWATESTAND-N	Hot water from stand-alone systems for new houses	Hot water from stand-alone systems for new houses
RWESA00	Existing delivery technology for stand-alone hot water systems, existing houses (not an actual technology, no cost & efficiency=1)	Existing delivery technology for stand-alone hot water systems, existing houses (not an actual technology, no cost & efficiency=1)
RWESA01	New delivery technology for stand-alone hot water systems, existing houses (not an actual technology, no cost & efficiency=1)	New delivery technology for stand-alone hot water systems, existing houses (not an actual technology, no cost & efficiency=1)
RWESOLRS00	Existing solar water heater	Existing solar water heater
RWEWHTRE00	Existing instant electric water heater (small)	Existing instant electric water heater (small)
RWEWHTRE01	New instant electric water heater (small)	New instant electric water heater (small)
RWEWHTRG00	Existing gas instant water heater	Existing gas instant water heater
RWEWHTRG01	New gas instant water heater	New gas instant water heater
RWNSA01	New delivery technology for stand-alone hot water systems, new houses (not an actual technology, no cost & efficiency=1)	New delivery technology for stand-alone hot water systems, new houses (not an actual technology, no cost & efficiency=1)
RWNWHTRE01	New instant electric water heater (small)	New instant electric water heater (small)
RWNWHTRG01	New gas instant water heater	New gas instant water heater
SCH	Final demand commodity for cooling in high-consumption services buildings (in PJ)	Final demand commodity for cooling in high-consumption services buildings (in PJ)
SCHDAIR00	Existing dry air cooling systems for high-consumption services buildings	Existing dry air cooling systems for high-consumption services buildings
SCHDAIR01	New dry air cooling systems for high-consumption services buildings	New dry air cooling systems for high-consumption services buildings
SCHDELVAIR	Cool air from dry air cooling systems in high-consumption services buildings	Cool air from dry air cooling systems in high-consumption services buildings
SCHP-ADM01	New CHP based on anaerobic digestion of wet biomass waste	New CHP based on anaerobic digestion of wet biomass waste
SCHP-CCG00	Existing CCGT CHP based on natural gas	Existing CCGT CHP based on natural gas
SCHP-CCG01	New CCGT CHP based on natural gas	New CCGT CHP based on natural gas
SCHP-CCH01	New CCGT CHP based on hydrogen	New CCGT CHP based on hydrogen
SCHP-FCH01	New hydrogen fuel cell	New hydrogen fuel cell
SCHP-GES00	Existing gas engine CHP based on sewage gas	Existing gas engine CHP based on sewage gas
SCHP-GES01	New gas engine CHP based on sewage gas	New gas engine CHP based on sewage gas
SCHP-STM01	New steam turbine CHP based on municipal waste	New steam turbine CHP based on municipal waste
SCHP-STW00	Existing steam turbine CHP based on biomass / municipal waste	Existing steam turbine CHP based on biomass / municipal waste
SCHP-STW01	New steam turbine CHP based on wood pellets	New steam turbine CHP based on wood pellets
SCK	Final demand commodity for cooking (in PJ)	Final demand commodity for cooking (in PJ)
SCKELC000	Existing electric cooking devices (in PJ_a)	Existing electric cooking devices (in PJ_a)
SCKELC001	New electric cooking devices (in PJ_a)	New electric cooking devices (in PJ_a)
SCKHYG001	New hydrogen cooking devices (in PJ_a)	New hydrogen cooking devices (in PJ_a)
SCKLFO001	New oil cooking devices (in PJ_a)	New oil cooking devices (in PJ_a)
SCKNGA000	Existing natural gas cooking devices (in PJ_a)	Existing natural gas cooking devices (in PJ_a)
SCKNGA001	New natural gas cooking devices (in PJ_a)	New natural gas cooking devices (in PJ_a)
SCKOTH000	Existing other cooking devices (in PJ_a)	Existing other cooking devices (in PJ_a)
SCP	Final demand commodity for computing (in PJ)	Final demand commodity for computing (in PJ)
SCPECOMP00	Existing computers (in PJ_a)	Existing computers (in PJ_a)
SCPECOMP01	New computers (in PJ_a)	New computers (in PJ_a)
SCSVACON01	Conservation technology for heating in high-consumption services buildings: More efficient air conditioning	Conservation technology for heating in high-consumption services buildings: More efficient air conditioning
SCSVCAVW01	Conservation technology for heating in all services buildings: Cavity wall insulation	Conservation technology for heating in all services buildings: Cavity wall insulation
SCSVLPDT01	Conservation technology for lighting in office buildings: Presence detector	Conservation technology for lighting in office buildings: Presence detector
SCSVLTMR01	Conservation technology for lighting in office buildings: Lighting timer	Conservation technology for lighting in office buildings: Lighting timer
SCSVPTHM01	Conservation technology for heating in all services buildings: Programmable thermostats	Conservation technology for heating in all services buildings: Programmable thermostats
SCSVROFF01	Conservation technology for heating in all services buildings: Flat roof insulation	Conservation technology for heating in all services buildings: Flat roof insulation
SCSVROFP01	Conservation technology for heating in all services buildings: Pitched roof insulation	Conservation technology for heating in all services buildings: Pitched roof insulation
SDH-BLRC00	Existing district heating boiler station based on coal	Existing district heating boiler station based on coal
SDH-BLRC01	New district heating boiler station based on coal	New district heating boiler station based on coal
SDH-BLRE01	New electric immersion heater for district heating	New electric immersion heater for district heating
SDH-BLRG00	Existing district heating boiler station based on natural gas	Existing district heating boiler station based on natural gas
SDH-BLRG01	New district heating boiler station based on natural gas	New district heating boiler station based on natural gas
SDH-BLRH01	New district heating boiler station based on hydrogen	New district heating boiler station based on hydrogen
SDH-BLRW01	New district heating boiler station based on wood pellets	New district heating boiler station based on wood pellets
SDH-SWHS01	New central solar heating plant	New central solar heating plant
SDISTELC00	Existing electricity distribution network to the services sector	Existing electricity distribution network to the services sector
SDISTELC01	New electricity distribution network to the services sector	New electricity distribution network to the services sector
SERBIOLFO	Bio-light fuel oil for the services sector	Bio-light fuel oil for the services sector
SERBOG	Sewage gas for the services sector	Sewage gas for the services sector
SERBOM	Biomethane for the services sector (before distribution grid)	Biomethane for the services sector (before distribution grid)
SERBUILDBOM	Biomethane for low-consumption service sector buildings (after service pipelines)	Biomethane for low-consumption service sector buildings (after service pipelines)
SERBUILDELC	Electricity for low-consumption service sector buildings (after electricity meters)	Electricity for low-consumption service sector buildings (after electricity meters)
SERBUILDGAS	Natural gas for low-consumption service sector buildings (after service pipelines)	Natural gas for low-consumption service sector buildings (after service pipelines)
SERBUILDHYG	Hydrogen for low-consumption service sector buildings (after service pipelines)	Hydrogen for low-consumption service sector buildings (after service pipelines)
SERCH4N	energy-related CH4 (sector-wise accounting system, services sector)	energy-related CH4 (sector-wise accounting system, services sector)
SERCO2N	energy-related CO2 (sector-wise accounting system, services sector)	energy-related CO2 (sector-wise accounting system, services sector)
SERCOA	Coal for the services sector	Coal for the services sector
SERDISTELC	Electricity for the services sector (after distribution grid)	Electricity for the services sector (after distribution grid)
SERELC	Electricity for the services sector (before distribution grid)	Electricity for the services sector (before distribution grid)
SERELC-NS	Dummy electricity commodity for night storage heaters in low-consumption services buildings	Dummy electricity commodity for night storage heaters in low-consumption services buildings
SERHFCP	process-related HFC (sector-wise accounting system, services sector)	process-related HFC (sector-wise accounting system, services sector)
SERHFO	Heavy fuel oil for the services sector	Heavy fuel oil for the services sector
SERHYG	Hydrogen (gaseous) for the services sector (before distribution grid)	Hydrogen (gaseous) for the services sector (before distribution grid)
SERHYGREF	Hydrogen from decentralized reformers for services buildings	Hydrogen from decentralized reformers for services buildings
SERKER	Kerosene (heating oil) for the services sector	Kerosene (heating oil) for the services sector
SERLFO	Light fuel oil for the services sector	Light fuel oil for the services sector
SERLPG	Liquified petroleum gas for the services sector	Liquified petroleum gas for the services sector
SERLTH	District heat for the services sector	District heat for the services sector
SERMAINSBOM	Biomethane for the services sector (after distribution grid)	Biomethane for the services sector (after distribution grid)
SERMAINSGAS	Natural gas for the services sector (after distribution grid)	Natural gas for the services sector (after distribution grid)
SERMAINSHYG	Hydrogen (gaseous) for the services sector (after distribution grid)	Hydrogen (gaseous) for the services sector (after distribution grid)
SERMSWBIO	Wet biomass waste for the services sector	Wet biomass waste for the services sector
SERMSWINO	Inorganic waste for the services sector	Inorganic waste for the services sector
SERMSWORG	Organic waste for the services sector	Organic waste for the services sector
SERN2ON	energy-related N2O (sector-wise accounting system, services sector)	energy-related N2O (sector-wise accounting system, services sector)
SERNGA	Natural gas for the services sector (before distribution grid)	Natural gas for the services sector (before distribution grid)
SERPELH	Wood pellets (high quality) for the services sector	Wood pellets (high quality) for the services sector
SERSOL	Solar energy for the services sector	Solar energy for the services sector
SERWOD	Woody energy crops for the services sector	Woody energy crops for the services sector
SHH	Final demand commodity for space heat in high-consumption services buildings (in PJ)	Final demand commodity for space heat in high-consumption services buildings (in PJ)
SHHA-CAE00	Existing air conditioning unit (HFC as refrigerant)	Existing air conditioning unit (HFC as refrigerant)
SHHA-CAE01	New air conditioning unit (standard, HFC as refrigerant)	New air conditioning unit (standard, HFC as refrigerant)
SHHA-CAE02	Advanced air conditioning unit (with HFO and HC as refrigerant)	Advanced air conditioning unit (with HFO and HC as refrigerant)
SHHBLRRC00	Existing coal boiler (intermediate size)	Existing coal boiler (intermediate size)
SHHBLRRC01	New coal boiler (intermediate size)	New coal boiler (intermediate size)
SHHBLRRE00	Existing electric boiler (intermediate size)	Existing electric boiler (intermediate size)
SHHBLRRE01	New electric boiler (intermediate size)	New electric boiler (intermediate size)
SHHBLRRG00	Existing gas boiler (intermediate size)	Existing gas boiler (intermediate size)
SHHBLRRG01	New gas boiler (intermediate size)	New gas boiler (intermediate size)
SHHBLRRH01	New hydrogen boiler (intermediate size)	New hydrogen boiler (intermediate size)
SHHBLRRO00	Existing oil boiler (intermediate size)	Existing oil boiler (intermediate size)
SHHBLRRO01	New oil boiler (intermediate size)	New oil boiler (intermediate size)
SHHBLRRW00	Existing biomass / waste boiler (intermediate size)	Existing biomass / waste boiler (intermediate size)
SHHBLRRW01	New biomass / waste boiler (intermediate size)	New biomass / waste boiler (intermediate size)
SHHCSV	Fuel dummy produced by conservation technologies (in PJ, replaces fuel input in heat technologies for high-consumption service sector buildings)	Fuel dummy produced by conservation technologies (in PJ, replaces fuel input in heat technologies for high-consumption service sector buildings)
SHHDAIR00	Existing dry air heating systems for high-consumption services buildings	Existing dry air heating systems for high-consumption services buildings
SHHDAIR01	New dry air heating systems for high-consumption services buildings	New dry air heating systems for high-consumption services buildings
SHHDELVAIR	Heat from dry air heating systems in high-consumption services buildings	Heat from dry air heating systems in high-consumption services buildings
SHHDELVRAD	Heat from wet radiator systems in high-consumption services buildings	Heat from wet radiator systems in high-consumption services buildings
SHHDHP100	Existing district heat pipelines for high-consumption services buildings	Existing district heat pipelines for high-consumption services buildings
SHHDHP101	New district heat pipelines for high-consumption services buildings	New district heat pipelines for high-consumption services buildings
SHHDRAD00	Existing wet heating and hot water pipes and radiators for high-consumption services buildings	Existing wet heating and hot water pipes and radiators for high-consumption services buildings
SHHDRAD01	New wet heating and hot water pipes and radiators for high-consumption services buildings	New wet heating and hot water pipes and radiators for high-consumption services buildings
SHHFCLRH01	New hydrogen fuel cell 	New hydrogen fuel cell 
SHHVACAE00	Existing HVAC system	Existing HVAC system
SHHVACAE01	New HVAC system (standard, HFC-based)	New HVAC system (standard, HFC-based)
SHHVACAE02	Advanced HVAC system (HFO & HC based)	Advanced HVAC system (HFO & HC based)
SHL	Final demand commodity for space heat in low-consumption services buildings (in PJ)	Final demand commodity for space heat in low-consumption services buildings (in PJ)
SHLAHBRE01	New air-source heat pump with radiator heating in combination with gas condensing boiler	New air-source heat pump with radiator heating in combination with gas condensing boiler
SHLAHBUE01	New air-source heat pump with underfloor heating in combination with gas condensing boiler	New air-source heat pump with underfloor heating in combination with gas condensing boiler
SHLAHPRE00	Existing air-source heat pumps with radiator heating	Existing air-source heat pumps with radiator heating
SHLAHPRE01	New air-source heat pump with radiator heating	New air-source heat pump with radiator heating
SHLAHPUE01	New air-source heat pump with underfloor heating	New air-source heat pump with underfloor heating
SHLAHSRE01	New air-source heat pump with radiator heating in combination with solar thermal heating system	New air-source heat pump with radiator heating in combination with solar thermal heating system
SHLAHSUE01	New air-source heat pump with underfloor heating in combination with solar thermal heating system	New air-source heat pump with underfloor heating in combination with solar thermal heating system
SHLBLCRG00	Existing gas condensing boiler	Existing gas condensing boiler
SHLBLCRG01	New gas condensing boiler	New gas condensing boiler
SHLBLCRH01	New hydrogen condensing boiler	New hydrogen condensing boiler
SHLBLCRO00	Existing oil condensing boiler	Existing oil condensing boiler
SHLBLCRO01	New oil condensing boiler	New oil condensing boiler
SHLBLCRP01	New pellet standard boiler	New pellet standard boiler
SHLBLRRC00	Existing coal boiler	Existing coal boiler
SHLBLRRE01	New electric standard boiler	New electric standard boiler
SHLBLRRG00	Existing gas standard boiler	Existing gas standard boiler
SHLBLRRO00	Existing oil standard boiler	Existing oil standard boiler
SHLBLRRW00	Existing biomass / waste boiler	Existing biomass / waste boiler
SHLBLRRW01	New wood standard boiler	New wood standard boiler
SHLBLSRE01	New electric standard boiler in combination with solar thermal heating system	New electric standard boiler in combination with solar thermal heating system
SHLBLSRG01	New gas condensing boiler in combination with solar thermal heating system	New gas condensing boiler in combination with solar thermal heating system
SHLBLSRH01	New hydrogen condensing boiler in combination with solar thermal heating system	New hydrogen condensing boiler in combination with solar thermal heating system
SHLBLSRO01	New oil condensing boiler in combination with solar thermal heating system	New oil condensing boiler in combination with solar thermal heating system
SHLBLSRP01	New pellet standard boiler with solar thermal heating system	New pellet standard boiler with solar thermal heating system
SHLBLSRW01	New wood standard boiler with solar thermal heating system	New wood standard boiler with solar thermal heating system
SHLCHBRH01	New hydrogen micro-CHP (boiler only)	New hydrogen micro-CHP (boiler only)
SHLCHPRG01	New gas micro-CHP (stirling engine)	New gas micro-CHP (stirling engine)
SHLCHPRH01	New hydrogen micro-CHP (fuel cell)	New hydrogen micro-CHP (fuel cell)
SHLCHPRW01	New wood pellets micro-CHP (stirling engine)	New wood pellets micro-CHP (stirling engine)
SHLCSV	Fuel dummy produced by conservation technologies (in PJ, replaces fuel input in heat technologies for low-consumption service sector buildings)	Fuel dummy produced by conservation technologies (in PJ, replaces fuel input in heat technologies for low-consumption service sector buildings)
SHLDELVAIR	Space heat from stand-alone systems for low-consumption service sector buildings	Space heat from stand-alone systems for low-consumption service sector buildings
SHLDELVRAD	Heat from wet radiator systems in low-consumption services buildings	Heat from wet radiator systems in low-consumption services buildings
SHLDELVUND	Heat from underfloor heating systems in low-consumption services buildings	Heat from underfloor heating systems in low-consumption services buildings
SHLDHP101	New district heat pipelines for low-consumption services buildings	New district heat pipelines for low-consumption services buildings
SHLDRAD00	Existing wet heating and hot water pipes and radiators for low-consumption services buildings	Existing wet heating and hot water pipes and radiators for low-consumption services buildings
SHLDRAD01	New wet heating and hot water pipes and radiators for low-consumption services buildings	New wet heating and hot water pipes and radiators for low-consumption services buildings
SHLDSTD00	Existing delivery technology for stand-alone space heating systems in low-consumption services buildings (not an actual technology, no cost & efficiency=1)	Existing delivery technology for stand-alone space heating systems in low-consumption services buildings (not an actual technology, no cost & efficiency=1)
SHLDSTD01	New delivery technology for stand-alone space heating systems in low-consumption services buildings (not an actual technology, no cost & efficiency=1)	New delivery technology for stand-alone space heating systems in low-consumption services buildings (not an actual technology, no cost & efficiency=1)
SHLDUND01	New underfloor pipes for heating and hot water in low-consumption services buildings	New underfloor pipes for heating and hot water in low-consumption services buildings
SHLGHBRE01	New ground-source heat pump with radiator heating in combination with gas condensing boiler	New ground-source heat pump with radiator heating in combination with gas condensing boiler
SHLGHBUE01	New ground-source heat pump with underfloor heating in combination with gas condensing boiler	New ground-source heat pump with underfloor heating in combination with gas condensing boiler
SHLGHPRE01	New ground-source heat pump with radiator heating	New ground-source heat pump with radiator heating
SHLGHPUE01	New ground-source heat pump with underfloor heating	New ground-source heat pump with underfloor heating
SHLGHSRE01	New ground-source heat pump with radiator heating in combination with solar heating system	New ground-source heat pump with radiator heating in combination with solar heating system
SHLGHSUE01	New ground-source heat pump with underfloor heating in combination with solar heating system	New ground-source heat pump with underfloor heating in combination with solar heating system
SHLNSTRE00	Existing electric night storage heater	Existing electric night storage heater
SHLNSTRE01	New electric night storage heater	New electric night storage heater
SHLREFCG01	New hydrogen fuel cell reformer	New hydrogen fuel cell reformer
SHLSHTRE00	Existing electric stand-alone space heater	Existing electric stand-alone space heater
SHLSHTRE01	New electric stand-alone space heater	New electric stand-alone space heater
SHLSHTRG00	Existing gas stand-alone space heater	Existing gas stand-alone space heater
SHLSHTRO00	Existing oil stand-alone space heater	Existing oil stand-alone space heater
SHLSTGNT00	Existing dummy supply technology for existing electric night storage heaters (not an actual technology, only ensures that night storage heaters are charged during night)	Existing dummy supply technology for existing electric night storage heaters (not an actual technology, only ensures that night storage heaters are charged during night)
SHLSTGNT01	New dummy supply technology for new electric night storage heaters (not an actual technology, only ensures that night storage heaters are charged during night)	New dummy supply technology for new electric night storage heaters (not an actual technology, only ensures that night storage heaters are charged during night)
SKNELCCO2B	Captured emissions from electricity generation with biomass	Captured emissions from electricity generation with biomass
SKNELCCO2C	Sequestered emissions from coal CCS	Sequestered emissions from coal CCS
SKNELCCO2G	Sequestered emissions from natural gas CCS	Sequestered emissions from natural gas CCS
SKNELCCO2O	Sequestered emissions from oil CCS	Sequestered emissions from oil CCS
SKNHYGCO2B	Captured emissions from hydrogen generation with biomass	Captured emissions from hydrogen generation with biomass
SKNHYGCO2C	Captured emissions from hydrogen generation with coal	Captured emissions from hydrogen generation with coal
SKNHYGCO2G	Captured emissions from hydrogen generation with gas	Captured emissions from hydrogen generation with gas
SKNHYGCO2W	Captured emissions from hydrogen generation with waste	Captured emissions from hydrogen generation with waste
SKNINDCO2N	Captured energy-related emissions from industry 	Captured energy-related emissions from industry 
SKNINDCO2P	Captured process-related emissions from industry 	Captured process-related emissions from industry 
SLOF	Final demand commodity for lighting (offices, in million units)	Final demand commodity for lighting (offices, in million units)
SLOFCSV	Fuel dummy produced by conservation technologies (in PJ, replaces electricity input in lighting technologies for office buildings)	Fuel dummy produced by conservation technologies (in PJ, replaces electricity input in lighting technologies for office buildings)
SLOFEFLU00	Existing office fluorescent lighting (in million units_a)	Existing office fluorescent lighting (in million units_a)
SLOFEFLU01	New office fluorescent lighting (in million units_a)	New office fluorescent lighting (in million units_a)
SLOFELED01	New office LED lighting (in million units_a)	New office LED lighting (in million units_a)
SLOT	Final demand commodity for lighting (other services buildings, in million units)	Final demand commodity for lighting (other services buildings, in million units)
SLOTECCL00	Existing CCL lighting for other services buildings (in million units_a)	Existing CCL lighting for other services buildings (in million units_a)
SLOTECCL01	New CCL lighting for other services buildings (in million units_a)	New CCL lighting for other services buildings (in million units_a)
SLOTELED01	New LED lighting for other services buildings (in million units_a)	New LED lighting for other services buildings (in million units_a)
SMAINPGAS00	Existing gas distribution grid to the services sector	Existing gas distribution grid to the services sector
SMAINPGAS01	New gas distribution grid to the services sector	New gas distribution grid to the services sector
SMAINPHYG01	New hydrogen distribution grid to the services sector	New hydrogen distribution grid to the services sector
SMETERELC00	Existing electricity meters for low-consumption services buildings	Existing electricity meters for low-consumption services buildings
SMETERELC01	New electricity meters for low-consumption services buildings	New electricity meters for low-consumption services buildings
SOL	Solar energy	Solar energy
SOTH	Final demand commodity for other non-heat devices in the services sector (in PJ)	Final demand commodity for other non-heat devices in the services sector (in PJ)
SOTHELC00	Existing other electric non-heat devices (in PJ_a)	Existing other electric non-heat devices (in PJ_a)
SOTHELC01	New other electric non-heat devices (in PJ_a)	New other electric non-heat devices (in PJ_a)
