Code	Short	Long
IFDDRYNGA02	Advanced drying / separation technology based on natural gas	Advanced drying / separation technology based on natural gas
IFDDRYSTM00	Existing drying / separation technology based on low-temperature steam/heat from CHP (not an actual technology, only transfers heat from CHP plants, therefore no cost/capacity)	Existing drying / separation technology based on low-temperature steam/heat from CHP (not an actual technology, only transfers heat from CHP plants, therefore no cost/capacity)
IFDDRYSTM01	New drying / separation technology based on low-temperature steam/heat from CHP (not an actual technology, only transfers heat from CHP plants, therefore no cost/capacity)	New drying / separation technology based on low-temperature steam/heat from CHP (not an actual technology, only transfers heat from CHP plants, therefore no cost/capacity)
IFDLTH	Low temperature heat for the food, drink and tobacco industry	Low temperature heat for the food, drink and tobacco industry
IFDLTHBIOG01	New low-temperature heat technology based on biogas	New low-temperature heat technology based on biogas
IFDLTHBIOG02	Advanced low-temperature heat technology based on biogas	Advanced low-temperature heat technology based on biogas
IFDLTHBIOL01	New low-temperature heat technology based on liquid biomass	New low-temperature heat technology based on liquid biomass
IFDLTHBIOL02	Advanced low-temperature heat technology based on liquid biomass	Advanced low-temperature heat technology based on liquid biomass
IFDLTHBIOS01	New low-temperature heat technology based on solid biomass	New low-temperature heat technology based on solid biomass
IFDLTHBIOS02	Advanced low-temperature heat technology based on solid biomass	Advanced low-temperature heat technology based on solid biomass
IFDLTHELC00	Existing low-temperature heat technology based on electricity	Existing low-temperature heat technology based on electricity
IFDLTHELC01	New low-temperature heat technology based on electricity	New low-temperature heat technology based on electricity
IFDLTHELC02	Advanced low-temperature heat technology based on electricity	Advanced low-temperature heat technology based on electricity
IFDLTHHCO00	Existing low-temperature heat technology based on coal	Existing low-temperature heat technology based on coal
IFDLTHHCO01	New low-temperature heat technology based on coal	New low-temperature heat technology based on coal
IFDLTHHCO02	Advanced low-temperature heat technology based on coal	Advanced low-temperature heat technology based on coal
IFDLTHHDG01	New low-temperature heat technology based on hydrogen	New low-temperature heat technology based on hydrogen
IFDLTHHDG02	Advanced low-temperature heat technology based on hydrogen	Advanced low-temperature heat technology based on hydrogen
IFDLTHHFO00	Existing low-temperature heat technology based on heavy fuel oil	Existing low-temperature heat technology based on heavy fuel oil
IFDLTHHFO01	New low-temperature heat technology based on heavy fuel oil	New low-temperature heat technology based on heavy fuel oil
IFDLTHHFO02	Advanced low-temperature heat technology based on heavy fuel oil	Advanced low-temperature heat technology based on heavy fuel oil
IFDLTHLFO00	Existing low-temperature heat technology based on light fuel oil	Existing low-temperature heat technology based on light fuel oil
IFDLTHLFO01	New low-temperature heat technology based on light fuel oil	New low-temperature heat technology based on light fuel oil
IFDLTHLFO02	Advanced low-temperature heat technology based on light fuel oil	Advanced low-temperature heat technology based on light fuel oil
IFDLTHNGA00	Existing low-temperature heat technology based on natural gas	Existing low-temperature heat technology based on natural gas
IFDLTHNGA01	New low-temperature heat technology based on natural gas	New low-temperature heat technology based on natural gas
IFDLTHNGA02	Advanced low-temperature heat technology based on natural gas	Advanced low-temperature heat technology based on natural gas
IFDLTHSTM00	Existing low-temperature heat technology based on low-temperature steam/heat from CHP (not an actual technology, only transfers heat from CHP plants, therefore no cost/capacity)	Existing low-temperature heat technology based on low-temperature steam/heat from CHP (not an actual technology, only transfers heat from CHP plants, therefore no cost/capacity)
IFDLTHSTM01	New low-temperature heat technology based on low-temperature steam/heat from CHP (not an actual technology, only transfers heat from CHP plants, therefore no cost/capacity)	New low-temperature heat technology based on low-temperature steam/heat from CHP (not an actual technology, only transfers heat from CHP plants, therefore no cost/capacity)
IFDMOT	Motor drive for the food, drink and tobacco industry	Motor drive for the food, drink and tobacco industry
IFDMOTELC00	Existing electric motor technology	Existing electric motor technology
IFDMOTELC01	New electric motor technology	New electric motor technology
IFDMOTELC02	Advanced electric motor technology	Advanced electric motor technology
IFDOTH	Other energy services for the food, drink and tobacco industry	Other energy services for the food, drink and tobacco industry
IFDOTHBIOG01	New generic process technology for other energy services based on biogas	New generic process technology for other energy services based on biogas
IFDOTHBIOL01	New generic process technology for other energy services based on liquid biomass	New generic process technology for other energy services based on liquid biomass
IFDOTHBIOS01	New generic process technology for other energy services based on solid biomass	New generic process technology for other energy services based on solid biomass
IFDOTHELC00	Existing generic process technology for other energy services based on electricity	Existing generic process technology for other energy services based on electricity
IFDOTHELC01	New generic process technology for other energy services based on electricity	New generic process technology for other energy services based on electricity
IFDOTHHCO00	Existing generic process technology for other energy services based on coal	Existing generic process technology for other energy services based on coal
IFDOTHHCO01	New generic process technology for other energy services based on coal	New generic process technology for other energy services based on coal
IFDOTHHDG01	New generic process technology for other energy services based on hydrogen	New generic process technology for other energy services based on hydrogen
IFDOTHHFO00	Existing generic process technology for other energy services based on heavy fuel oil	Existing generic process technology for other energy services based on heavy fuel oil
IFDOTHHFO01	New generic process technology for other energy services based on heavy fuel oil	New generic process technology for other energy services based on heavy fuel oil
IFDOTHLFO00	Existing generic process technology for other energy services based on light fuel oil	Existing generic process technology for other energy services based on light fuel oil
IFDOTHLFO01	New generic process technology for other energy services based on light fuel oil	New generic process technology for other energy services based on light fuel oil
IFDOTHNGA00	Existing generic process technology for other energy services based on natural gas / biomethane	Existing generic process technology for other energy services based on natural gas / biomethane
IFDOTHNGA01	New generic process technology for other energy services based on natural gas / biomethane	New generic process technology for other energy services based on natural gas / biomethane
IFDOTHSTM00	Existing generic process technology for other energy services based on low-temperature steam/heat from CHP (not an actual technology, only transfers heat from CHP plants, therefore no cost/capacity)	Existing generic process technology for other energy services based on low-temperature steam/heat from CHP (not an actual technology, only transfers heat from CHP plants, therefore no cost/capacity)
IFDOTHSTM01	New generic process technology for other energy services based on low-temperature steam/heat from CHP (not an actual technology, only transfers heat from CHP plants, therefore no cost/capacity)	New generic process technology for other energy services based on low-temperature steam/heat from CHP (not an actual technology, only transfers heat from CHP plants, therefore no cost/capacity)
IFDREF	Refrigeration for the food, drink and tobacco industry	Refrigeration for the food, drink and tobacco industry
IFDREFEHFC00	Exisitng refrigeration technology	Exisitng refrigeration technology
IFDREFEHFC01	New refrigeration technology	New refrigeration technology
IFDREFEHFO01	Advanced refrigeration technology (with HFO as refrigerant, less HFC emissions)	Advanced refrigeration technology (with HFO as refrigerant, less HFC emissions)
IFDSTM	Low-temperature steam/heat from CHP for the food, drink and tobacco industry	Low-temperature steam/heat from CHP for the food, drink and tobacco industry
IHVC	High-value chemicals (demand commodity in Mt)	High-value chemicals (demand commodity in Mt)
IIS	Finished Steel (demand commodity)	Finished Steel (demand commodity)
IISALLBLF00	Existing allocation process for blast furnaces (not an actual technology, only allocates fuels to a specific technology, efficiency of 1 and no costs, alternative to improvement technology)	Existing allocation process for blast furnaces (not an actual technology, only allocates fuels to a specific technology, efficiency of 1 and no costs, alternative to improvement technology)
IISALLBLF01	New allocation process for blast furnaces (not an actual technology, only allocates fuels to a specific technology, efficiency of 1 and no costs, alternative to improvement technology)	New allocation process for blast furnaces (not an actual technology, only allocates fuels to a specific technology, efficiency of 1 and no costs, alternative to improvement technology)
IISALLCHR00	Existing allocation process for casters & hot rolling mills (not an actual technology, only allocates fuels to a specific technology, efficiency of 1 and no costs, alternative to improvement technology)	Existing allocation process for casters & hot rolling mills (not an actual technology, only allocates fuels to a specific technology, efficiency of 1 and no costs, alternative to improvement technology)
IISALLCHR01	New allocation process for casters & hot rolling mills (not an actual technology, only allocates fuels to a specific technology, efficiency of 1 and no costs, alternative to improvement technology)	New allocation process for casters & hot rolling mills (not an actual technology, only allocates fuels to a specific technology, efficiency of 1 and no costs, alternative to improvement technology)
IISALLEAF00	Existing allocation process for electric arc furnaces (not an actual technology, only allocates fuels to a specific technology, efficiency of 1 and no costs, alternative to improvement technology)	Existing allocation process for electric arc furnaces (not an actual technology, only allocates fuels to a specific technology, efficiency of 1 and no costs, alternative to improvement technology)
IISALLEAF01	New allocation process for electric arc furnaces (not an actual technology, only allocates fuels to a specific technology, efficiency of 1 and no costs, alternative to improvement technology)	New allocation process for electric arc furnaces (not an actual technology, only allocates fuels to a specific technology, efficiency of 1 and no costs, alternative to improvement technology)
IISALLSIN00	Existing allocation process for sinter plants (not an actual technology, only allocates fuels to a specific technology, efficiency of 1 and no costs, alternative to improvement technology)	Existing allocation process for sinter plants (not an actual technology, only allocates fuels to a specific technology, efficiency of 1 and no costs, alternative to improvement technology)
IISALLSIN01	New allocation process for sinter plants (not an actual technology, only allocates fuels to a specific technology, efficiency of 1 and no costs, alternative to improvement technology)	New allocation process for sinter plants (not an actual technology, only allocates fuels to a specific technology, efficiency of 1 and no costs, alternative to improvement technology)
IISALLTGS01	New allocation process for blast furnace top gas (converts blast furnace top gas into blast furnace gas, efficiency of 1 & no cost)	New allocation process for blast furnace top gas (converts blast furnace top gas into blast furnace gas, efficiency of 1 & no cost)
IISBFGB	Blast furnace gas for blast furnaces	Blast furnace gas for blast furnaces
IISBFGC	Blast furnace gas for casters and hot rolling mills	Blast furnace gas for casters and hot rolling mills
IISBLAFUR00	Existing blast furnace	Existing blast furnace
IISBLAFUR01	New blast furnace, standard	New blast furnace, standard
IISBLFIMP01	Improvement technology 1 for existing and new standard blast furnaces: pulverized coal injection (can be applied to IISBLAFUR00 & IISBLAFUR01, increases efficiency of blast furnaces)	Improvement technology 1 for existing and new standard blast furnaces: pulverized coal injection (can be applied to IISBLAFUR00 & IISBLAFUR01, increases efficiency of blast furnaces)
IISBLFIMP02	Improvement technology 2 for existing and new standard blast furnaces: heat recovery (can be applied to IISBLAFUR00 & IISBLAFUR01, increases efficiency of blast furnaces)	Improvement technology 2 for existing and new standard blast furnaces: heat recovery (can be applied to IISBLAFUR00 & IISBLAFUR01, increases efficiency of blast furnaces)
IISBOIBFG00	Exisiting blast furnace gas boiler for low temperature heat	Exisiting blast furnace gas boiler for low temperature heat
IISBOIBFG01	New blast furnace gas boiler for low temperature heat	New blast furnace gas boiler for low temperature heat
IISBOIBIOS01	New solid biomass boiler for low temperature heat	New solid biomass boiler for low temperature heat
IISBOICOG00	Exisiting coke oven gas boiler for low temperature heat	Exisiting coke oven gas boiler for low temperature heat
IISBOICOG01	New coke oven gas boiler for low temperature heat	New coke oven gas boiler for low temperature heat
IISBOIHFO00	Existing heavy fuel oil boiler for low temperature heat	Existing heavy fuel oil boiler for low temperature heat
IISBOIHYG01	New hydrogen boiler for low temperature heat	New hydrogen boiler for low temperature heat
IISBOINGA01	New natural gas boiler for low temperature heat	New natural gas boiler for low temperature heat
IISBOXFUR00	Existing basic oxygen furnace	Existing basic oxygen furnace
IISBOXFUR01	New basic oxygen furnace, standard	New basic oxygen furnace, standard
IISCASHRM00	Existing caster & hot rolling mill	Existing caster & hot rolling mill
IISCASHRM01	New caster & hot rolling mill, standard	New caster & hot rolling mill, standard
IISCASHRM02	New thin slab and strip caster and hot rolling mill	New thin slab and strip caster and hot rolling mill
IISCHPBFG00	Existing CHP based on blast furnace gas	Existing CHP based on blast furnace gas
IISCHPBFG01	New gas turbine CHP based on blast furnace gas	New gas turbine CHP based on blast furnace gas
IISCHPBIOG01	New CCGT CHP based on biogases	New CCGT CHP based on biogases
IISCHPBIOS01	New steam turbine CHP based on solid biomass	New steam turbine CHP based on solid biomass
IISCHPCCGT01	New CCGT CHP based on natural gas	New CCGT CHP based on natural gas
IISCHPCCGTH01	New CCGT CHP based on hydrogen	New CCGT CHP based on hydrogen
IISCHPCOG00	Existing CHP based on coke oven gas	Existing CHP based on coke oven gas
IISCHPCOG01	New gas turbine CHP based on coke oven gas	New gas turbine CHP based on coke oven gas
IISCHPFCH01	New hydrogen fuel cell	New hydrogen fuel cell
IISCHPGT01	New gas turbine CHP based on natural gas	New gas turbine CHP based on natural gas
IISCHPHFO00	Existing CHP based on heavy fuel oil	Existing CHP based on heavy fuel oil
IISCHPNGA00	Existing CHP based on natural gas	Existing CHP based on natural gas
IISCOACOKB	Coking coal for blast furnaces	Coking coal for blast furnaces
IISCOGB	Coke oven gas for blast furnaces	Coke oven gas for blast furnaces
IISCOGC	Coke oven gas for casters and hot rolling mills	Coke oven gas for casters and hot rolling mills
IISCOKB	Coke for blast furnaces	Coke for blast furnaces
IISCOKE	Coke for electric arc furnaces	Coke for electric arc furnaces
IISCOKS	Coke for sinter plants	Coke for sinter plants
IISEAFSPH01	Improvement technology 1 for existing and new standard electric arc furnaces: Scrap preheat (shaft furnace) (can be applied to IISELAFUR00 & IISELAFUR01, increases efficiency of electric arc furnaces)	Improvement technology 1 for existing and new standard electric arc furnaces: Scrap preheat (shaft furnace) (can be applied to IISELAFUR00 & IISELAFUR01, increases efficiency of electric arc furnaces)
IISELAFUR00	Existing electric arc furnace	Existing electric arc furnace
IISELAFUR01	New electric arc furnace, standard	New electric arc furnace, standard
IISELAFUR02	New Comelt electric arc furnace	New Comelt electric arc furnace
IISELAFUR03	New twin shell DC with shaft preheat electric arc furnace	New twin shell DC with shaft preheat electric arc furnace
IISELCB	Electricity for blast furnaces	Electricity for blast furnaces
IISELCC	Electricity for casters and hot rolling mills	Electricity for casters and hot rolling mills
IISELCE	Electricity for electric arc furnaces	Electricity for electric arc furnaces
IISELCS	Electricity for sinter plants	Electricity for sinter plants
IISFINPRO00	Existing downstream process (energy use to produce finished steel from hot rolled steel)	Existing downstream process (energy use to produce finished steel from hot rolled steel)
IISFINPRO01	New downstream process (energy use to produce finished steel from hot rolled steel)	New downstream process (energy use to produce finished steel from hot rolled steel)
IISHFOB	Heavy fuel oil for blast furnaces	Heavy fuel oil for blast furnaces
IISHISAR01	New HISarna blast furnace	New HISarna blast furnace
IISHISARQ01	New HISarna blast furnace with CCS	New HISarna blast furnace with CCS
IISHRMIMP01	Improvement technology 1 for existing and new standard casters & hot rolling mills: aggregate improvement (can be applied to IISCASHRM00 & IISCASHRM01, increases efficiency of casters & hot rolling mills)	Improvement technology 1 for existing and new standard casters & hot rolling mills: aggregate improvement (can be applied to IISCASHRM00 & IISCASHRM01, increases efficiency of casters & hot rolling mills)
IISHRS	Hot rolled steel (intermediate product, in Mt)	Hot rolled steel (intermediate product, in Mt)
IISLST	Liquid steel (intermediate product, in Mt)	Liquid steel (intermediate product, in Mt)
IISLTH	Low-temperature steam/heat from CHP/boilers for the iron & steel industry	Low-temperature steam/heat from CHP/boilers for the iron & steel industry
IISLTHB	Low-temperature steam/heat from CHP/boilers for blast furnaces	Low-temperature steam/heat from CHP/boilers for blast furnaces
IISLTHC	Low-temperature steam/heat from CHP/boilers for casters and hot rolling mills	Low-temperature steam/heat from CHP/boilers for casters and hot rolling mills
IISLTHE	Low-temperature steam/heat from CHP/boilers for electric arc furnaces	Low-temperature steam/heat from CHP/boilers for electric arc furnaces
IISLTHS	Low-temperature steam/heat from CHP/boilers for sinter plants	Low-temperature steam/heat from CHP/boilers for sinter plants
IISMIDREX01	New MIDREX direct reduced iron route (alternative to electric arc furnace)	New MIDREX direct reduced iron route (alternative to electric arc furnace)
IISNGAB	Natural gas for blast furnaces	Natural gas for blast furnaces
IISNGAC	Natural gas for casters and hot rolling mills	Natural gas for casters and hot rolling mills
IISNGAE	Natural gas for electric arc furnaces	Natural gas for electric arc furnaces
IISPIR	Pig iron (intermediate product, in Mt)	Pig iron (intermediate product, in Mt)
IISSINHRC01	Improvement technology 1 for existing and new standard sinter plants: Exhaust gas heat recovery (can be applied to IISSINTER00 & IISSINTER01, increases efficiency of sinter plants)	Improvement technology 1 for existing and new standard sinter plants: Exhaust gas heat recovery (can be applied to IISSINTER00 & IISSINTER01, increases efficiency of sinter plants)
IISSINTER00	Exisitng sinter plant	Exisitng sinter plant
IISSINTER01	New sinter plant, standard	New sinter plant, standard
IISSNT	Sinter (intermediate product, in Mt)	Sinter (intermediate product, in Mt)
IISTGRBF01	New top-gas recovery blast furnace	New top-gas recovery blast furnace
IISTGRBFQ01	New top-gas recovery blast furnace with CCS	New top-gas recovery blast furnace with CCS
IISTGS	Blast furnace top gas (is converted into blast furnace gas)	Blast furnace top gas (is converted into blast furnace gas)
IISULCORED01	New ULCORED Advanced Direct reduced iron route with CCS (alternative to electric arc furnace)	New ULCORED Advanced Direct reduced iron route with CCS (alternative to electric arc furnace)
IMAINPGAS00	Existing gas distribution grid to the industry sector	Existing gas distribution grid to the industry sector
IMAINPGAS01	New gas distribution grid to the industry sector	New gas distribution grid to the industry sector
IMAINPHYG01	New hydrogen distribution grid to the industry sector	New hydrogen distribution grid to the industry sector
IMPAGWST	Import process for dry agricultural residues	Import process for dry agricultural residues
IMPBGRASS	Import process for grassy energy crops	Import process for grassy energy crops
IMPBIODST	Import process for first-generation biodiesel	Import process for first-generation biodiesel
IMPBIODST-FT	Import process for second-generation biodiesel (Fischer-Tropsch)	Import process for second-generation biodiesel (Fischer-Tropsch)
IMPBIOOIL	Import process for bio-oil	Import process for bio-oil
IMPBVOFAT	Import process for vegetable waste oil	Import process for vegetable waste oil
IMPBVOIL	Import process for vegetable oil	Import process for vegetable oil
IMPBWOD	Import process for woody energy crops	Import process for woody energy crops
IMPBWODWST	Import process for waste wood	Import process for waste wood
IMPCOA	Import process for coal	Import process for coal
IMPCOACOK	Import process for coking coal	Import process for coking coal
IMPCOA-E	Re-Import process for domestic coal	Re-Import process for domestic coal
IMPCOK	Import process for coke	Import process for coke
IMPELC-EU	Import process for electricity from Continental Europe	Import process for electricity from Continental Europe
IMPELC-IRE	Import process for electricity from Ireland	Import process for electricity from Ireland
IMPETH	Import process for ethanol	Import process for ethanol
IMPHYL	Import process for liquid hydrogen	Import process for liquid hydrogen
IMPNGA-E	Re-Import process for domestic natural gas	Re-Import process for domestic natural gas
IMPNGA-EU	Import process for natural gas from the Netherlands/Belgium	Import process for natural gas from the Netherlands/Belgium
IMPNGA-LNG	Import process for liquified natural gas	Import process for liquified natural gas
IMPNGA-N	Import process for natural gas from Norway	Import process for natural gas from Norway
IMPOILCRD1	Import process for crude oil (raw)	Import process for crude oil (raw)
IMPOILCRD1-E	Re-Import process for domestic crude oil (raw)	Re-Import process for domestic crude oil (raw)
IMPOILCRD2	Import process for crude oil (processed)	Import process for crude oil (processed)
IMPOILDST	Import process for diesel	Import process for diesel
IMPOILHFO	Import process for heavy fuel oil	Import process for heavy fuel oil
IMPOILJET	Import process for kerosene (aviation fuel)	Import process for kerosene (aviation fuel)
IMPOILKER	Import process for kerosene (heating oil)	Import process for kerosene (heating oil)
IMPOILLFO	Import process for light fuel oil	Import process for light fuel oil
IMPOILLPG	Import process for liquified petroleum gas	Import process for liquified petroleum gas
IMPOILMSC	Import process for miscellaneous petroleum products (naphta, lubricants, bitumen, petroleum coke, etc.)	Import process for miscellaneous petroleum products (naphta, lubricants, bitumen, petroleum coke, etc.)
IMPOILPET	Import process for petrol	Import process for petrol
IMPURN	Import process for natural uranium	Import process for natural uranium
INDBENZ	Benzole and tars for the industry sector	Benzole and tars for the industry sector
INDBFG	Blast furnace gas for the industry sector	Blast furnace gas for the industry sector
INDBIOLFO	Bio-light fuel oil for the industry sector	Bio-light fuel oil for the industry sector
INDBIOOIL	Bio-oil for the industry sector	Bio-oil for the industry sector
INDBOG-AD	Biogas from anaerobic digestion for the industry sector	Biogas from anaerobic digestion for the industry sector
INDBOG-LF	Landfill gas for the industry sector	Landfill gas for the industry sector
INDBOM	Biomethane for the industry sector (before distribution grid)	Biomethane for the industry sector (before distribution grid)
INDCH4N	energy-related CH4 (sector-wise accounting system, industry)	energy-related CH4 (sector-wise accounting system, industry)
INDCO2N	energy-related CO2 (sector-wise accounting system, industry)	energy-related CO2 (sector-wise accounting system, industry)
INDCO2P	process-related CO2 (sector-wise accounting system, industry sector)	process-related CO2 (sector-wise accounting system, industry sector)
INDCOA	Coal for the industry sector	Coal for the industry sector
INDCOACOK	Coking coal for the industry sector	Coking coal for the industry sector
INDCOG	Coke oven gas for the industry sector	Coke oven gas for the industry sector
INDCOK	Coke for the industry sector	Coke for the industry sector
